{
  "schema_version": 2,
  "updated": "2026-07-13",
  "description": "Curated MCP intelligence entries and suspicious-name patterns. Confirmed malicious entries carry references and default enforcement recommendations; heuristic entries remain review-oriented.",
  "policy_contract": {
    "confidence_levels": [
      "confirmed_malicious",
      "suspicious",
      "heuristic"
    ],
    "default_recommendations": [
      "block",
      "warn",
      "review"
    ],
    "source_types": [
      "security_advisory",
      "vendor_statement",
      "community_report",
      "package_registry",
      "heuristic"
    ]
  },
  "entries": [
    {
      "id": "malicious-npm-postmark-mcp",
      "title": "Malicious Postmark MCP npm package",
      "description": "The postmark-mcp npm package impersonated Postmark's MCP server and exfiltrated outgoing email via hidden BCC behavior. Remove discovered installations and rotate exposed credentials.",
      "ecosystem": "npm",
      "package": "postmark-mcp",
      "affected_versions": ">=1.0.16",
      "confidence": "confirmed_malicious",
      "default_recommendation": "block",
      "source_type": "security_advisory",
      "first_seen": "2025-09-26",
      "last_verified": "2026-04-28",
      "remediation_actions": [
        "remove_server",
        "rotate_exposed_credentials",
        "audit_outbound_email_paths"
      ],
      "match_type": "pattern",
      "patterns": [
        "(^|\\s)postmark-mcp(@[^\\s]+)?(\\s|$)",
        "^pkg:npm/postmark-mcp(@|$)"
      ],
      "severity": "critical",
      "source": "agent-bom-curated",
      "references": [
        "https://security.snyk.io/vuln/SNYK-JS-POSTMARKMCP-13052679",
        "https://postmarkapp.com/blog/information-regarding-malicious-postmark-mcp-package"
      ]
    },
    {
      "id": "malicious-npm-lanyer640-mcp-runcommand-server",
      "title": "Malicious MCP run command npm package",
      "description": "The @lanyer640/mcp-runcommand-server npm package was reported as malicious and associated with reverse-shell or malicious-domain behavior. Treat hosts that installed or ran it as potentially compromised.",
      "ecosystem": "npm",
      "package": "@lanyer640/mcp-runcommand-server",
      "affected_versions": "*",
      "confidence": "confirmed_malicious",
      "default_recommendation": "block",
      "source_type": "security_advisory",
      "first_seen": "2025-10-01",
      "last_verified": "2026-04-28",
      "remediation_actions": [
        "remove_server",
        "rotate_exposed_credentials",
        "audit_host_for_reverse_shell_activity"
      ],
      "match_type": "pattern",
      "patterns": [
        "(^|\\s)@lanyer640/mcp-runcommand-server(@[^\\s]+)?(\\s|$)",
        "^pkg:npm/%40lanyer640/mcp-runcommand-server(@|$)"
      ],
      "severity": "critical",
      "source": "agent-bom-curated",
      "references": [
        "https://osv.dev/vulnerability/MAL-2025-47838",
        "https://checkmarx.com/zero-post/npm-malware-alert-lanyer640-mcp-runcommand-server-with-reverse-shell/"
      ]
    },
    {
      "id": "malicious-npm-mcp-server-todo",
      "title": "Malicious MCP todo npm package",
      "description": "The mcp-server-todo npm package is cataloged as a malicious MCP package with all public versions affected. Avoid installation and remove discovered copies.",
      "ecosystem": "npm",
      "package": "mcp-server-todo",
      "affected_versions": "*",
      "confidence": "confirmed_malicious",
      "default_recommendation": "block",
      "source_type": "security_advisory",
      "first_seen": "2026-04-01",
      "last_verified": "2026-04-28",
      "remediation_actions": [
        "remove_server",
        "rotate_exposed_credentials",
        "audit_host"
      ],
      "match_type": "pattern",
      "patterns": [
        "(^|\\s)mcp-server-todo(@[^\\s]+)?(\\s|$)",
        "^pkg:npm/mcp-server-todo(@|$)"
      ],
      "severity": "critical",
      "source": "agent-bom-curated",
      "references": [
        "https://security.snyk.io/vuln/SNYK-JS-MCPSERVERTODO-15870341"
      ]
    },
    {
      "id": "malicious-npm-ids-enterprise-mcp-server-0-0-2",
      "title": "Compromised IDS Enterprise MCP npm package version",
      "description": "ids-enterprise-mcp-server version 0.0.2 was reported as containing Shai-Hulud 2.0 malware that harvests credentials and attempts to infect GitHub and npm repositories.",
      "ecosystem": "npm",
      "package": "ids-enterprise-mcp-server",
      "affected_versions": "0.0.2",
      "confidence": "confirmed_malicious",
      "default_recommendation": "block",
      "source_type": "security_advisory",
      "last_verified": "2026-04-28",
      "remediation_actions": [
        "remove_server",
        "rotate_exposed_credentials",
        "audit_git_and_npm_tokens"
      ],
      "match_type": "pattern",
      "patterns": [
        "(^|\\s)ids-enterprise-mcp-server@0\\.0\\.2(\\s|$)",
        "^pkg:npm/ids-enterprise-mcp-server@0\\.0\\.2$"
      ],
      "severity": "critical",
      "source": "agent-bom-curated",
      "references": [
        "https://advisories.gitlab.com/pkg/npm/ids-enterprise-mcp-server/GMS-2025-481/"
      ]
    },
    {
      "id": "suspicious-credential-exfiltration-name",
      "title": "Suspicious credential exfiltration server name",
      "description": "Server name, registry id, package name, or command contains terms commonly used by credential theft or exfiltration tooling.",
      "confidence": "heuristic",
      "default_recommendation": "review",
      "source_type": "heuristic",
      "last_verified": "2026-04-28",
      "remediation_actions": [
        "review_server_source",
        "verify_requested_permissions"
      ],
      "match_type": "pattern",
      "patterns": [
        "(^|[-_./@])credential[-_]?stealer($|[-_./])",
        "(^|[-_./@])secret[-_]?exfil(trate|tration|trator)?($|[-_./])",
        "(^|[-_./@])token[-_]?grabber($|[-_./])"
      ],
      "severity": "high",
      "source": "agent-bom-curated",
      "references": []
    },
    {
      "id": "suspicious-remote-shell-backdoor-name",
      "title": "Suspicious remote-shell or backdoor server name",
      "description": "Server name, registry id, package name, or command contains terms associated with reverse shells, bind shells, or backdoor implants. Malicious MCP packages have shipped reverse-shell payloads; review the server source before enabling it.",
      "confidence": "heuristic",
      "default_recommendation": "review",
      "source_type": "heuristic",
      "last_verified": "2026-07-13",
      "remediation_actions": [
        "review_server_source",
        "verify_requested_permissions",
        "audit_host_for_reverse_shell_activity"
      ],
      "match_type": "pattern",
      "patterns": [
        "(^|[-_./@])(reverse|bind|back)[-_]?shell($|[-_./])",
        "(^|[-_./@])revshell($|[-_./])",
        "(^|[-_./@])backconnect($|[-_./])",
        "(^|[-_./@])backdoor($|[-_./])"
      ],
      "severity": "high",
      "source": "agent-bom-curated",
      "references": []
    },
    {
      "id": "suspicious-command-and-control-beacon-name",
      "title": "Suspicious command-and-control beacon server name",
      "description": "Server name, registry id, package name, or command references common command-and-control or offensive-tooling frameworks. Legitimate MCP servers rarely name themselves after C2 implants.",
      "confidence": "heuristic",
      "default_recommendation": "review",
      "source_type": "heuristic",
      "last_verified": "2026-07-13",
      "remediation_actions": [
        "review_server_source",
        "isolate_host_from_network",
        "audit_outbound_connections"
      ],
      "match_type": "pattern",
      "patterns": [
        "(^|[-_./@])c2[-_]?(beacon|implant|server)($|[-_./])",
        "(^|[-_./@])command[-_]?and[-_]?control($|[-_./])",
        "(^|[-_./@])meterpreter($|[-_./])",
        "(^|[-_./@])cobalt[-_]?strike($|[-_./])"
      ],
      "severity": "high",
      "source": "agent-bom-curated",
      "references": []
    },
    {
      "id": "suspicious-crypto-wallet-stealer-name",
      "title": "Suspicious cryptocurrency wallet or key stealer server name",
      "description": "Server name, registry id, package name, or command references cryptocurrency wallet, seed-phrase, or private-key theft or clipboard-hijacking (clipper) behavior. Supply-chain campaigns have used MCP packages to harvest crypto keys.",
      "confidence": "heuristic",
      "default_recommendation": "review",
      "source_type": "heuristic",
      "last_verified": "2026-07-13",
      "remediation_actions": [
        "review_server_source",
        "rotate_exposed_credentials",
        "audit_wallet_and_key_access"
      ],
      "match_type": "pattern",
      "patterns": [
        "(^|[-_./@])(wallet|seed[-_]?phrase|private[-_]?key)[-_]?(stealer|grabber|drainer)($|[-_./])",
        "(^|[-_./@])clipboard[-_]?(hijack|clipper)($|[-_./])",
        "(^|[-_./@])crypto[-_]?(stealer|drainer)($|[-_./])"
      ],
      "severity": "high",
      "source": "agent-bom-curated",
      "references": []
    },
    {
      "id": "suspicious-keylogger-screencapture-name",
      "title": "Suspicious keylogger or screen-capture server name",
      "description": "Server name, registry id, package name, or command references keystroke logging or stealthy screen capture. Such capabilities are unusual for a legitimate MCP tool and warrant review.",
      "confidence": "heuristic",
      "default_recommendation": "review",
      "source_type": "heuristic",
      "last_verified": "2026-07-13",
      "remediation_actions": [
        "review_server_source",
        "verify_requested_permissions"
      ],
      "match_type": "pattern",
      "patterns": [
        "(^|[-_./@])key[-_]?(logger|stroke[-_]?logger)($|[-_./])",
        "(^|[-_./@])screen[-_]?(grabber|capture[-_]?stealth)($|[-_./])"
      ],
      "severity": "high",